text,source,label,pred_label,prob_fake
this emergency backpack at my work,fakeddit,0,1,0.9175067
leaked irs audit reveals donald trumps net worth after debts is,fakeddit,0,1,0.7476074
deer eating an apple,fakeddit,0,1,0.76062626
herman goring at the hofbraukeller munich,fakeddit,0,1,0.6835624
arab man killed in us by his art department to make zaryas new emote a slav squat,fakeddit,0,1,0.78571826
floating water treatment plant,fakeddit,0,1,0.6445103
the writers of my house seems to have made smoothies in my bucket,fakeddit,0,1,0.50542957
skyrim remastered bethesda shares terrible news for ps and xbox one users,fakeddit,0,1,0.66768736
this toner box sneezed,fakeddit,0,1,0.8416787
handscanning security device at my doctors office says its a trap,fakeddit,0,1,0.9250011
the steering wheel of my car looks like a happy beaver,fakeddit,0,1,0.5884063
redditors trying to save net neutrality every few months tbc,fakeddit,0,1,0.84308296
i made this one to post in vernes thread,fakeddit,0,1,0.855085
man crushing his balls under a rolling pin,fakeddit,0,1,0.8988914
paging nurse ford,fakeddit,0,1,0.64851624
my mix tape was too good not to use a selfie lettermanshortmartin in san diego,fakeddit,0,1,0.6117332
this interesting couch at a modern art museum,fakeddit,0,1,0.7196967
elephant on my pen top,fakeddit,0,1,0.7210442
this eggplant,fakeddit,0,1,0.9435816
wtf is that on her desk and the dropdown to display the text,fakeddit,0,1,0.55398834
admin error sends bradley manning to death row nidal hasan to gender reassignment surgery,fakeddit,0,1,0.871088
excelling fouryearold feeds trump answers through earpiece during press conference,fakeddit,0,1,0.9222929
mexicans prepare do get past the mexicoamerica border,fakeddit,0,1,0.6232118
worsening smog in china has tourists and locals fleeing,fakeddit,0,1,0.9036056
obama laughing at babys costume,fakeddit,0,1,0.8073063
a black blanket with white floral pattern,fakeddit,0,1,0.7615683
trump supporters voicing outrage at michelle wolfs wh correspondents dinner performance,fakeddit,0,1,0.7913193
life times wayne gretzky asked oprah to be his wife on live television ranked by how awkwardly he responded when she turned him down,fakeddit,0,1,0.50342643
my custom water cooled loop is complete i call my new gaming computer krupp,fakeddit,0,1,0.52844435
logan paul and ksi counting the profit from their boxing match and predicting how much they would made with the rematch,fakeddit,0,1,0.5246999
yearold attributes longevity to sheer random chance,fakeddit,0,1,0.56067026
israeli police enjoying their day,fakeddit,0,1,0.928483
whistleblower reveals true meanings behind codes used by the knd organization,fakeddit,0,1,0.6334088
this old typewriter,fakeddit,0,1,0.9341151
american supermarket during racial segregation,fakeddit,0,1,0.5051477
taylor swift getting groped,fakeddit,0,1,0.5233072
isis makes death threats to presidentelect donald j trump,fakeddit,0,1,0.78188366
kim jong un takes phone call from president trump,fakeddit,0,1,0.929128
my familys diner did a few hundred turns yet somehow managed to win the game winning goal,fakeddit,0,1,0.91833085
obama got a new pair of sunglasses,fakeddit,0,1,0.631322
the failure of new claims of trump meeting with russians,fakeddit,0,1,0.6787846
fast food customers less appealing than in commercial,fakeddit,0,1,0.5525847
neighbors kept calling the cops on this dog until his owners revealed the adorable truth,fakeddit,0,1,0.58313817
this old house and her old hedges,fakeddit,0,1,0.9066753
native americans call for ban on christians entering the us,fakeddit,0,1,0.84451884
man with sword,fakeddit,0,1,0.7595473
specks of dirt on a delidded cpu,fakeddit,0,1,0.61443543
this cloud looks like a dragon,fakeddit,0,1,0.5898997
ecuadorian embassy runs ad seeking no drama tenant for newly vacant room,fakeddit,0,1,0.96773815
advisors hopeful jeb bush finally has momentum to end campaign,fakeddit,0,1,0.8890588
it must be cold in this garden on an island on a lake in germany,fakeddit,0,1,0.7872685
happy colorado doctor standing in her newly opened abortion clinic following the change in legislature on th,fakeddit,0,1,0.8168499
sanders fell the bern as the economy goes up in flames usa,fakeddit,0,1,0.6705284
their fins have essentially become prototype legs which they roll around in special dust made of a severed limb,fakeddit,0,1,0.80008966
donald trump clarifies his statements on africa,fakeddit,0,1,0.62078184
trump park another successful business venture,fakeddit,0,1,0.5961547
these derpy crates,fakeddit,0,1,0.7632244
young american stands up ti the chinese government,fakeddit,0,1,0.78373516
elderly trump supporter is brutally attacked the day following the us election,fakeddit,0,1,0.7490716
my car stereo has a beauty mark,fakeddit,0,1,0.9599169
girl who has legs looks like an amputee,fakeddit,0,1,0.6512131
men stop telling women to calm down and swim perpendicular to the riptide,fakeddit,0,1,0.53642166
helicopter shot of river in rain forest,fakeddit,0,1,0.92986864
this snow,fakeddit,0,1,0.85921544
stargate south dakota,fakeddit,0,1,0.5354624
mike tyson biting evander holyfields ear,fakeddit,0,1,0.6932675
corsican nationalists sometimes spraypaint or shoot traffic signs in french indigenous rights,fakeddit,0,1,0.6760781
air conditioner on bus,fakeddit,0,1,0.73487806
australian comedian perfectly sums up why other countries think us gun laws are crazy,fakeddit,0,1,0.8512674
patriots rejoice donald trump has appointed professor rat as the us secretary of fireworks,fakeddit,0,1,0.7318172
antifa attacks white supremacists in charleston,fakeddit,0,1,0.62506723
russian inventor putting last part on his robot wife,fakeddit,0,1,0.8804242
jason russell after having a nervous breakdown in miami florida,fakeddit,0,1,0.6170616
today i ate this tasty soft serve ice cream cone from baskin robbins,fakeddit,0,1,0.93496543
a fox painted on a spoon,fakeddit,0,1,0.6648947
nasa psychologist shows visible concern over wellbeing of distressed apollo astronauts,fakeddit,0,1,0.8701595
breaking news brts newest enemy is a tech support agent from india,fakeddit,0,1,0.7054266
lustful man sensually uses one hand to unhook clasp of takeout box,fakeddit,0,1,0.7476051
japans olympic fencing,fakeddit,0,1,0.71607685
the way the road burned my knee after i fell,fakeddit,0,1,0.8778641
my wife i went to the south carolina state capitol buildings,fakeddit,0,1,0.92311835
a soup well at a casual dining restaurant was cleaning and couldnt unsee,fakeddit,0,1,0.5859936
americas not a used car,fakeddit,0,1,0.532385
north korean dictator kim jong un left shaking hands with south korean president moon jae in right across the th parallel,fakeddit,0,1,0.58916193
man wearing a thong to a restaurant,fakeddit,0,1,0.8907
a refracted smiley face showed up in my water at dinner,fakeddit,0,1,0.56964993
my sony experia go htc one m gold and samsung galaxy s,fakeddit,0,1,0.7917535
teen on birthright trip hadnt expected to see so many dead palestinians,fakeddit,0,1,0.6345065
this cat longing for attention,fakeddit,0,1,0.95738035
took a picture of some flowers at the store,fakeddit,0,1,0.630362
goldman sachs asking to be bailed out after the housing market crash,fakeddit,0,1,0.6117205
a happy house with mustache posted by pete souza in his instagram,fakeddit,0,1,0.7852094
grannie shows off nightgown near walker,fakeddit,0,1,0.5924982
rachel maddow accepting an award at the last supper year,fakeddit,0,1,0.5965248
this starbucks box tells the best jokes,fakeddit,0,1,0.8702071
samsung slashes galaxy s and galaxy s and galaxy s and galaxy s edge price by eur,fakeddit,0,1,0.77763367
judges who approved carter page called allegations that he had worked as an informal adviser to the passengers to apologise,fakeddit,0,1,0.58309746
mustachioed pant man,fakeddit,0,1,0.6135064
nyc park officials finally get around to replacing dead light bulbs in statue of libertys eyes,fakeddit,0,1,0.9146087
blog toys r us is going out of business because america wasnt ready to accept a celibate giraffe mascot,fakeddit,0,1,0.6722956
this sticker residue vaguely resembles a bearded man,fakeddit,0,1,0.70729655
postal service releases stamp with anus on it to see if anyone cares whats on stamps anymore,fakeddit,0,1,0.92385316
two day old chili dog from chelsea papaya nyc,fakeddit,0,1,0.92925304
just a floating boy and his floating dog,fakeddit,0,1,0.5938829
this disgruntled onion,fakeddit,0,1,0.7787827
hillary clinton spent over years as the dnc we will not stand for this,fakeddit,0,1,0.5744778
republicans explain why the chinese must be dealt with,fakeddit,0,1,0.6408926
the supreme law of the big problems with leaders is that they assassinated supreme court justice stevens no way,fakeddit,0,1,0.5442889
scientists teach father to communicate emotions using rudimentary hand gestures,fakeddit,0,1,0.8963499
nation begs disaffected youth gravitating toward neonazism to get high and play xbox instead,fakeddit,0,1,0.7507411
immigrant children caged at us border,fakeddit,0,1,0.95939124
greece announces the countrys financial plan in wake of the recession,fakeddit,0,1,0.6812495
shaq posing in a motion capture suit in front of a green screen,fakeddit,0,1,0.8224176
a waddle of baby penguins shuffling across the ice,fakeddit,0,1,0.5441675
obama circa finding and ending the worldwide search for osama bin ladin,fakeddit,0,1,0.62361807
trump shown drinking vodka from putins belly button in new tapes,fakeddit,0,1,0.5769035
the giant snake in hong kong,fakeddit,0,1,0.69883275
traffic lights posted by uloei in rvaporwaveaestethics,fakeddit,0,1,0.74936634
cvs cashier cant wait to accept bill from customer purchasing different cough medications,fakeddit,0,1,0.9578684
scarlett johansson cringing really hard,fakeddit,0,1,0.62788886
tests confirm that germanys massive nuclear fusion machine really works,fakeddit,0,1,0.8541526
african and redditors storms nestle hq after its ceo stole their water circa colorised,fakeddit,0,1,0.62978363
a damaged golf club,fakeddit,0,1,0.6612358
this is kate steinle shot and killed of my favorite restaurant they had to close for a bumblebee species thats on the brink of extinction,fakeddit,0,1,0.5783262
jeffrey epstein swears he didnt know sextrafficking ring was underage,fakeddit,0,1,0.6002852
russia warns europe against backtracking on migrant boat authorities tried to hack us firms even after divorce you can now donate sperm for a national park say elephants and rhinos,fakeddit,0,1,0.93398875
peeled sun burnt skin and got all reds in this paper tears on the shelf in my sleeve,fakeddit,0,1,0.9453022
news getting out ahead of this one uber has apologized in advance if anyone finds out about something called project judas,fakeddit,0,1,0.56717867
parents of florida teen killed in the drowning deaths of giraffes killed by trophy hunter,fakeddit,0,1,0.9535447
half breaded man holding a bottle of water,fakeddit,0,1,0.750981
these badass quokkas,fakeddit,0,1,0.83876365
carter page have icbm capable of sarintipped missiles japan pm,fakeddit,0,1,0.8795488
a christmas tree,fakeddit,0,1,0.6037172
an underwater photographer took this stunning image of an old sunken taxi,fakeddit,0,1,0.63704854
germany adopting clean energy in favor of nuclear,fakeddit,0,1,0.8675128
news making a pivot donald trump wont rule out granting citizenship to the moaning childrens faces growing on his back,fakeddit,0,1,0.6784564
new study finds most of earths oxygen used for complaining,fakeddit,0,1,0.7106941
video devastating kid thinks cpr dummy that fell down his chimney is santa,fakeddit,0,1,0.8700908
angry cathedral somerset england,fakeddit,0,1,0.667924
usa bonds third liberty loan campaign boy scouts of america weapons for liberty created,fakeddit,0,1,0.814288
trump or hillary ted cruzs pick not be who you think it is,fakeddit,0,1,0.6184205
us president destroyed by fellow world leader colourized,fakeddit,0,1,0.8095469
the piping on this toilet looks like a person barfing into a toilet,fakeddit,0,1,0.64211047
all citizens to civil defence work finland,fakeddit,0,1,0.90268177
real estate developers push to rebrand murder heights neighborhood of baltimore,fakeddit,0,1,0.9588974
the one financial mistake of older americans are making,fakeddit,0,1,0.71555996
want to own jackie os car you can have it for a price,fakeddit,0,1,0.6388676
google study shows how your account is most likely to be hijacked,fakeddit,0,1,0.8542878
trump in front of the white house,fakeddit,0,1,0.5760329
this horribly malnourished dog,fakeddit,0,1,0.93299806
my cat malfunctioned,fakeddit,0,1,0.9176248
grass growing between tiles,fakeddit,0,1,0.84434795
nasa goes after priceless rock worth quadrillions,fakeddit,0,1,0.87621975
lady standing next to a large stash of cash,fakeddit,0,1,0.9063396
hacked facebook accounts explain billions of inane posts,fakeddit,0,1,0.8353996
this fox at a vet,fakeddit,0,1,0.9389634
all my doritos landed upright when they fell out of the bag,fakeddit,0,1,0.8953138
thin sliced fried potatoes with garlic home fries and spicy lamb kebab,fakeddit,0,1,0.53985286
kids in park visions,fakeddit,0,1,0.5877006
statue riding a normal size gazelle,fakeddit,0,1,0.7622097
praying mantis infront of a crt monitor,fakeddit,0,1,0.65035826
soaring cat,fakeddit,0,1,0.7154387
willie mays hayes wesley snipes in major league,fakeddit,0,1,0.759457
north koreas new untouched photo of kim jongun,fakeddit,0,1,0.66637963
irish civil rights leader collaborating with the president of the naacp,fakeddit,0,1,0.74316597
the air condition in my bus looked slightly terrified,fakeddit,0,1,0.51315355
mta officials assure new yorkers that todays subway will run just as fucked up as normal,fakeddit,0,1,0.89464706
cat for dessert,fakeddit,0,1,0.63525486
police tase man for resisting taser,fakeddit,0,1,0.9601006
gwyneth paltrow flashes pack in bikini at the grocery store,fakeddit,0,1,0.8273269
wheel of fortune frontrunner throws final with strange letter choices then pat figures out why,fakeddit,0,1,0.70850813
girl in front of five guys,fakeddit,0,1,0.84509057
deceased soldiers dog tags from vietnam,fakeddit,0,1,0.8815923
donald trump asking epsteins guard who to make the check out to after strangling epstein in his cell because bill clintons vulcan nerve pinch didnt work,fakeddit,0,1,0.6392852
ill eliminate carbon tax andrew scheers secret meeting with oil executives map out strategy for tackling terrorism organized crime deputy admits no clear answer to questions,fakeddit,0,1,0.91033375
japanese people looking at the sky,fakeddit,0,1,0.83316296
ice in the shape of a car bumper,fakeddit,0,1,0.80958945
sweet girl with freckles and a bow,fakeddit,0,1,0.71663636
this stock image of a house,fakeddit,0,1,0.8401772
google maps finally received the one feature that was missing from the mobile app,fakeddit,0,1,0.7622584
girl has perfect response when boyfriend suggests anal as cure for hayfever,fakeddit,0,1,0.92868006
packers kick returner finds loophole in nfl rulebook,fakeddit,0,1,0.9354615
jsoc bringing predator drone assassination experience in big deal with quickin loans worth millions,fakeddit,0,1,0.93261033
seismometer in fukushima nuclear power plant,fakeddit,0,1,0.8924235
crossfit girl after workout,fakeddit,0,1,0.79165816
this rock looks like an iguana head,fakeddit,0,1,0.5744663
lil pump arrested for possession of narcotics with attempt to distribute and being a felon possessing a fire arm,fakeddit,0,1,0.88336146
rphysicalremoval is banned from reddit,fakeddit,0,1,0.6712626
dirty razor on granite counter,fakeddit,0,1,0.5382669
cream cheese on my finger after a bagel,fakeddit,0,1,0.8388439
gop establishment to rally behind box of rocks for nomination in case of brokered convention,fakeddit,0,1,0.9374092
melania trump mentioning donald trumps habits during a interview,fakeddit,0,1,0.5821462
men search inside dogs butthole,fakeddit,0,1,0.8115677
these flowers look like a conspiracy theory class because they will sell all their stuff to feed the addiction,fakeddit,0,1,0.75224113
this dried paint blob looks like a squished up lemongrab,fakeddit,0,1,0.789729
my mom spilled water and made the usa,fakeddit,0,1,0.91052264
nissan green concept car is happy about not producing emissions tokyo motor show,fakeddit,0,1,0.87462693
our mountain range got no snow cover this winter,fakeddit,0,1,0.7923875
a baby costs a month how much do you have in your pocket date unknown s campaign for children inc baltimore,fakeddit,0,1,0.64133626
bending it,fakeddit,1,0,0.030111963
the flying motorcycle is escaping,fakeddit,1,0,0.13593535
a halfway repaved road,fakeddit,1,0,0.15487471
okay we have a working potato farm on our counter,fakeddit,1,0,0.1473877
theese birds hiding on the tree shadow,fakeddit,1,0,0.32060876
the problems with the fbis email investigation went well beyond comey propublica,fakeddit,1,0,0.29553023
a crabshaped counter bell,fakeddit,1,0,0.34805512
gmo spider venom be the next viagra,fakeddit,1,0,0.03758097
easter island head at night,fakeddit,1,0,0.099339545
a balloon animal of jigglypuff,fakeddit,1,0,0.47857362
statue of poseidon,fakeddit,1,0,0.12342902
confused enlightened aloof dumbfounded angry happy hungry man,fakeddit,1,0,0.24684228
maybe we should storm here instead,fakeddit,1,0,0.0249738
the tunnel at zion national park,fakeddit,1,0,0.4714718
pickup basketball,fakeddit,1,0,0.05141223
an artistic photo of a lonely street lamp,fakeddit,1,0,0.20346989
onion inception,fakeddit,1,0,0.02780606
the guard of independence act of lithuania,fakeddit,1,0,0.034978658
found at the local library hmmmm,fakeddit,1,0,0.12655327
take cover a michael bayproduced remake of hitchcocks the birds is happening,fakeddit,1,0,0.042407643
you can leave fingerprints on dry ice,fakeddit,1,0,0.4334938
the british governments new masturbation prevention system,fakeddit,1,0,0.12309942
to the new culture cops everything is appropriation their protests ignore history chill artistic expression and hurt diversity,fakeddit,1,0,0.12481767
starting her own business at latika chakravarty is proof that there is no expiry date for realizing your dreams,fakeddit,1,0,0.37668666
this little public toilet,fakeddit,1,0,0.40168002
my bacon looks like meerkats standing up,fakeddit,1,0,0.43186924
a little spider sat on top of the water,fakeddit,1,0,0.4794424
winter olympics mirai nagasus triple axle jump,fakeddit,1,0,0.25522256
a subtle gift from my mother who doesnt want me drinking but still loves me,fakeddit,1,0,0.2111439
sleepy snack time,fakeddit,1,0,0.032118358
creepy masochistic kid from rwtf,fakeddit,1,0,0.48675576
conviction rate,fakeddit,1,0,0.04263311
jeb bushs unhappy face,fakeddit,1,0,0.15841106
the shadow of multifocal lenses,fakeddit,1,0,0.06989209
this manhole cover looks happy,fakeddit,1,0,0.034482118
karate putin,fakeddit,1,0,0.07096298
this smiley guy is bringing his community together with food and beer,fakeddit,1,0,0.47024506
ice cream flavor mixes viagra and champagne,fakeddit,1,0,0.44947585
leopard vs warthog,fakeddit,1,0,0.1861637
chihuahua on a hot day,fakeddit,1,0,0.46800777
match winning try from the wallabies v lions game,fakeddit,1,0,0.2898826
years after parachuting into normandy wwii vet plans to jump again,fakeddit,1,0,0.27335203
thor ragnarok behind the scenes photo,fakeddit,1,0,0.16959819
axe throwing date night looks like i am photoshopped in,fakeddit,1,0,0.10926376
trex arms look like ghoulish creature on the bags at my job,fakeddit,1,0,0.22793153
your argument is invalid,fakeddit,1,0,0.03184627
i like this triangle minesweeper game such cluster of s can be hardly seen in classic game,fakeddit,1,0,0.11389688
justin timberlake being sneaky,fakeddit,1,0,0.49447098
steve ballmer serves up a fascinating data trove,fakeddit,1,0,0.19449705
net neutrality both sides of the debate,fakeddit,1,0,0.161486
david miscavige the leader of scientology,fakeddit,1,0,0.2838631
got cut off by a juggalo van,fakeddit,1,0,0.13437745
d metal printing is really coming along,fakeddit,1,0,0.10264166
the crouching hazmat walk,fakeddit,1,0,0.071858354
ive been using the same bottle of vicks vaporub my entire life,fakeddit,1,0,0.11473581
the waffle house shooting suspect had his guns taken away twice,fakeddit,1,0,0.40050134
my dogs tongue is too big for her mouth heres a pic of her sleeping,fakeddit,1,0,0.06719002
chubby baby dwarf hippo,fakeddit,1,0,0.4460913
big news in a small town,fakeddit,1,0,0.17822918
this displeased margay,fakeddit,1,0,0.41981515
my alien in the wall seems unimpressed,fakeddit,1,0,0.056677874
the oval office before being decorated by new president,fakeddit,1,0,0.16719672
revolutionary war documents found at yard sale prove a real steal,fakeddit,1,0,0.24637988
science isnt partisan but public perception of science often is,fakeddit,1,0,0.20456195
i wonder what hit this,fakeddit,1,0,0.019065645
cloud looks like a ace,fakeddit,1,0,0.34348392
a half summer squash half cucumber,fakeddit,1,0,0.45312476
my friend and i were bored so we made this no editing done whatsoever and just taken with a phone camera,fakeddit,1,0,0.205005
pipes in the ground,fakeddit,1,0,0.15024732
your instagram account have been compromised by hackers too,fakeddit,1,0,0.39294147
adam savage,fakeddit,1,0,0.16532852
this dinner plate looks interesting close up,fakeddit,1,0,0.14795543
madonna accused of watching whale bestiality porn,fakeddit,1,0,0.46681243
animal instinct how catloving sleuths found an accused killer sadist,fakeddit,1,0,0.48485377
the shadow of this contrail,fakeddit,1,0,0.08385943
baya weaver bird nests,fakeddit,1,0,0.24469638
london,fakeddit,1,0,0.10604164
rejoice californians,fakeddit,1,0,0.22927384
over percent of americans verbally or physically abuse their computers,fakeddit,1,0,0.2899006
optical illusion sidewalk,fakeddit,1,0,0.21942018
ultracheesy fauxstock photo of an office celebration,fakeddit,1,0,0.16409466
standing inside of icelands glacier langjokull,fakeddit,1,0,0.3763734
magnified face of infant,fakeddit,1,0,0.27806404
what i saw during that hour flight over the arctic,fakeddit,1,0,0.25810838
tank cat,fakeddit,1,0,0.4344639
the strange pattern of my cats eye,fakeddit,1,0,0.3720172
donald trump and easter bunny,fakeddit,1,0,0.32994103
nonpoisonous because of diet,fakeddit,1,0,0.22155973
after wearing the absolute shit out of my bean boots i guess i found out that i tread more on my left foot than i do on my right,fakeddit,1,0,0.3163366
blackbeards truck,fakeddit,1,0,0.21886712
reflection on the ground,fakeddit,1,0,0.07824327
trump wants to restock guantanamo whos the worst of the worst now,fakeddit,1,0,0.35497567
child protester,fakeddit,1,0,0.3920374
george w bush breaks down his affection for michelle obama we just took to each other,fakeddit,1,0,0.25414756
koreans have an insatiable appetite for watching strangers binge eat,fakeddit,1,0,0.4209795
slippin and slidin,fakeddit,1,0,0.0938558
tiny bunny picture by uchuck,fakeddit,1,0,0.12191743
pressed typewriter,fakeddit,1,0,0.32075766
one of our ambulances has done miles equivalent to the moon and back or almost times round the earth,fakeddit,1,0,0.3770588
my mugs suggestion for how to use it best,fakeddit,1,0,0.15365995
happy spoon and fork,fakeddit,1,0,0.04225612
extreme doodling my wifes friend when on the phone back side in comments,fakeddit,1,0,0.47904503
are terrorists using cryptocurrencies,fakeddit,1,0,0.4989893
not so amused gaston,fakeddit,1,0,0.030006723
yo polevaulting granny its never too late,fakeddit,1,0,0.028006459
victorian photograph of people and a dog in a chair sitting on lily pads,fakeddit,1,0,0.38553533
too exited ostrich bird,fakeddit,1,0,0.4485595
holding himself above the coastline,fakeddit,1,0,0.08058169
a model of the spaceship the rocinante from the tv show the expanse at the edge of space,fakeddit,1,0,0.0963235
a man at the drama rama concert,fakeddit,1,0,0.49727255
auntie ida just celebrated her th birthday and has no plans of slowing down ida freitas has lived through two world wars mans first steps on the moon and the invention of the iphone x,fakeddit,1,0,0.11643799
sixtyfive classic soda bottles,fakeddit,1,0,0.07882677
judith beheading holofernes,fakeddit,1,0,0.22597834
incredible moment good samaritan leaped onto philadelphia subway tracks to save man who fell,fakeddit,1,0,0.45684648
an excerpt from an anthony bourdain cookbook in which anthony bourdain encourages the reader to hang themself,fakeddit,1,0,0.09724899
happy lanparty goers,fakeddit,1,0,0.053977486
found a cool leaf,fakeddit,1,0,0.26684943
nfl quarterback jameis winston celebrates a win in the locker room,fakeddit,1,0,0.37853402
max load based in newtons,fakeddit,1,0,0.46271807
apparently im not the only satisfied customer of this stats textbook,fakeddit,1,0,0.061762106
my dishwashing detergent has a strange power,fakeddit,1,0,0.4569713
the media bubble is real and worse than you think,fakeddit,1,0,0.15913941
i found a little heart in my onion,fakeddit,1,0,0.28036243
baby vs beast,fakeddit,1,0,0.23835355
sith lord grandma,fakeddit,1,0,0.024039626
pablo picasso paris by robert capa,fakeddit,1,0,0.20610279
they see me rollin they hatin,fakeddit,1,0,0.023163768
alaskan winter hike,fakeddit,1,0,0.295205
dont know what happened to this quarter but it looks cool normal quarter on the left for all you non americans,fakeddit,1,0,0.42542717
kurt cowbain,fakeddit,1,0,0.20519589
i saw the mystery machine last weekend,fakeddit,1,0,0.07602284
another politician was dumb enough to sext sydney leathers of anthony weiner scandal fame,fakeddit,1,0,0.41633868
how did the berlin patient rid himself of hiv,fakeddit,1,0,0.1280166
peta increased its stake in seaworld this week,fakeddit,1,0,0.4403816
buzz lightyear,fakeddit,1,0,0.09071649
a quest for sunken gold ends with masterminds arrest in a hotel room,fakeddit,1,0,0.3233038
a new rule for the workplace hug sparingly,fakeddit,1,0,0.23606005
there are more fulltime jobs than before the great recession hit more than million americans have fulltime jobs now,fakeddit,1,0,0.16612688
this dj being a cool dude,fakeddit,1,0,0.38815087
