text,source,label,pred_label,prob_fake
"We’ve all seen the horrific photos of children who are victims of the Syrian Civil War. Perhaps the most infamous is the one of the little boy sitting, covered in blood and dirt, barefoot, in the back of an ambulance. He is clearly in shock. It shows us just what that kind of war does to a society, to ordinary people, and children just like us, just like the kids in our own lives.

Well, there is one person who is completely unmoved by these images: Donald Trump Jr. The Donald’s mini me has long shown his lack of humanity. After all, he made a disgusting Holocaust reference when trying to tear down the media’s coverage of Hillary Clinton, saying if the GOP did what the Democrats are doing, they’d be “warming up the gas chamber.” Well, now, he’s gone into the gutter again, this time regarding Syrian refugees. Trump Jr sent out the following tweet, comparing refugees to a bowl of Skittles:

This image says it all. Let's end the politically correct agenda that doesn't put America first. #trump2016 pic.twitter.com/9fHwog7ssN — Donald Trump Jr. (@DonaldJTrumpJr) September 19, 2016

And as if this weren’t bad enough, comparing human beings to a bowl of candy, this is actually a white supremacist meme.

The Skittles are a reference to white supremacist meme. Changed from M&Ms to Skittles because of George Zimmerman. https://t.co/86FsWdft5O — Laura Seay (@texasinafrica) September 20, 2016

George Zimmerman is, of course, the wannabe cop who got away with murdering Trayvon Martin, a black teen who was walking home from the store in Florida with only a can of iced tea and a package of skittles. So, in other words, once again, Trump Jr. is openly courting white supremacists on his father’s behalf.

Skittles spokeswoman Denise Young said that her company, Wrigley, which is the parent company that produces skittles, didn’t believe Trump Jr’s image was “appropriate.” She went on to say:

“Skittles are candy. Refugees are people. We don’t feel it’s an appropriate analogy. We will respectfully refrain from further commentary as anything we say could be misinterpreted as marketing.”

The Trump campaign is so repugnant that even candy makers have to speak out. This meme is racist, disgusting, and is just another sign of what a morally bankrupt family the Trumps are. Do everything you can to keep them out of the White House, folks. VOTE BLUE.

Featured image via video screen capture",fakenewsnet,0,1,0.56006837
"Story highlights Donald Trump criticized Hillary Clinton for her approach to national security issues

It's a recurring theme of his campaign

Estero, Florida (CNN) Donald Trump, speaking two days after the latest terrorist attack on US soil, sought to paint his rival Hillary Clinton as a ""weak and ineffective"" leader not prepared to confront the threat of radical Islamic terrorism, as he talked up his radical policy prescriptions.

The Republican presidential nominee, addressing more than 8,000 people at his first rally since the bomb attacks in New York and New Jersey, talked up his hardline immigration policies, argued domestic terror suspects, even US citizens, should be tried as ""foreign enemy combatants"" -- rather than receive due process under US law.

He also slammed Clinton for what he said was being tougher on his supporters than on Islamist terrorism.

""Hillary Clinton talks tougher about my supporters than she does about radical Islamic terrorists,"" Trump said, pointing to Clinton's comments that half his supporters belong in a ""basket of deplorables.""

""Has she ever talked that way about radical Islam? No,"" Trump said. ""Are those words reserved only for hard-working Americans who truly love our country and they want to make a statement? One can be forgiven for getting the impression that these hardworking Americans are somehow a greater threat to our country than these Islamic extremists.""

Read More",fakenewsnet,0,1,0.50763613
