text,source,label,pred_label,prob_fake
"Toby Keith has been forced to cancel his show in South Carolina and it was totally unexpected.

Toby Keith was scheduled to perform at the Florence Civic Center in South Carolina on September 22 and he was forced to cancel. Unfortunately the night before the concert Toby Keith sent out an update to all of his fans sharing the heartbreaking news.

The good news is that Toby Keith didn’t have to cancel his concert because he was ill or hurt. The bad news is that there are huge fuel shortages in South Carolina and the gas prices are continuing to rise in the Southeast. The General Manager of the Florence Civic Center,Kendall Wall, shared that the venue had received many messages from fans stating that they weren’t going to be able to make it because of the fuel cancern.

Both Keith’s managers and the Florence Civic center decided that it was best for the fans if the concert was postponed to a later date. They wanted it to be fair for everyone who had already purchased their tickets.

“This is a major show for the region which attracts fans within a one- to two-hour drive and beyond…We understand the growing concerns for Toby’s fans and our own fans, as we’ve been receiving distress messages over the past couple days…It would be unfair for these fans and unrealistic for them to travel given the current dismal situation with gas prices and availability.”

The rescheduled concert date is March 7,2017 and the tickets will be honored for that concert. If any fan is unable to make the rescheduled concert date, there will be refunds made but only for a short amount of time.

Toby Keith is one of the most respected country artists and we hope that those fans who could have made the concert are understanding of the cancelation.

I’m glad that everyone is okay, but it is such a bummer that these things have to happen. Pray for South Carolina!",fakenewsnet,0,1,0.5901247
"If there’s anyone in this day and age who most definitely doesn’t mince words, and will say what needs to be said, it’s Vice President Joe Biden.

While speaking in Philadelphia, Pennsylvania on a campaign stop for Hillary Clinton, Biden tore into some of the remarks from Monday’s debate. Especially when Donald Trump seemed to think it’s perfectly fine to screw over the American people, or benefit from their sorrow.

Biden said:

“This is a guy who said — and wants to be president — that it was good business for him to see the housing market fail. What in the hell is he talking about?”

Adding:

“Every president I have served with, including Republicans, has had a moral center about what it was to be an American, about what we’re supposed to do, about what basic fundamental rights are.”

Then really getting to the core of it, he said:

“He does not have the basic fundamental sensibilities and values that almost every American politician left, right and center I know have. They disagree on how to make things better for you, but they don’t take pleasure from ‘You’re fired.’ They don’t take pleasure knowing that they will benefit.”

Biden also talked about how Trump seems proud of not paying taxes. Taxes that all of us have to pay and don’t have the luxury of manipulating the tax code to our advantage.

“He acknowledged that he didn’t pay taxes because, he said, he’s smart. Makes him smart. Tell that to the janitor in here who’s paying taxes. Tell that to your mothers and fathers who are breaking their neck to send you here who are paying their taxes. No I really mean it. It angers me.”

Biden knows, as we should all know by this point in the election, who the better choice is for Commander-in-Chief. He reiterates:

“If this choice isn’t clear, I don’t know –- my lord… What bothers me about this race is how palpable his cynicism is about the American people.”

And it’s true, the choice is abundantly clear — Hillary Rodham Clinton should and will be our next president.

Watch Biden lay into Trump here:

WATCH: VP Biden goes off on Trump over Trump’s comments about not paying taxes: “It angers me! … What in the hell is he talking about!?” pic.twitter.com/Qg5L5HcnvL — NBC Nightly News (@NBCNightlyNews) September 27, 2016

Featured image via video screen capture",fakenewsnet,0,1,0.50679487
"Tim Kaine visits the Pulse night club in Orlando Monday evening. | Burgess Everett/POLITICO Kaine visits site of Orlando mass shooting

ORLANDO -- Tim Kaine visited the Pulse night club here on Monday evening, the site where gunman Omar Mateen killed 49 people in June.

The Virginia senator laid flowers at a memorial surrounding the club. He attended alongside former Rep. Gabby Giffords (D-Ariz.), who was injured in a mass shooting in 2011, as well as Giffords's husband astronaut Mark Kelly and Sen. Bill Nelson (D-Fla.).

Story Continued Below

""The thing that's painful about this: this is a weird thing to say but I always hoped that Virginia Tech would be the worst one ever,"" Kaine told reporters after a quiet, 10-minute visit to the site. ""As bad as that was, I hoped nothing would ever eclipse it. But such is life. We got work to do.""

Kaine was Virginia's governor in 2007, when a shooter killed 32 people at the university.

Later Monday, Kaine, Giffords and Kelly are scheduled to attend a presidential debate watch party with LGBT activists here in Orlando.

Kaine's running mate, Hillary Clinton, visited Pulse in July.

Authors:",fakenewsnet,0,1,0.5176699
"Story highlights Barney Frank says the tea party was better at mobilizing

Frank says he thinks bipartisanship can return to Congress if Hillary Clinton is elected

The Axe Files, featuring David Axelrod, is a podcast distributed by CNN and produced at the University of Chicago Institute of Politics. The author works for David Axelrod.

Kiev (CNN) He was one of the most effective legislators in Washington, an icon of Democratic politics. Now Barney Frank says the left has been outmaneuvered by the tea party and the populist right.

""To my great regret, the tea party movement has had much more impact on American politics than Occupy Wall Street,"" Frank, former congressman from Massachusetts, said to David Axelrod on ""The Axe Files"" podcast, produced by the University of Chicago Institute of Politics and CNN.

""Because the tea party people correctly understood that, for them, what they needed to do was to get control of the political machinery, to register people to vote, to vote in primaries, and influence public policy,"" Frank continued. ""Occupy Wall Street decided that they would bring about great change by smoking pot and having drum circles, and it turns out voting in primaries is a better way to do it.""

The key to bringing about political change, Frank believes, is not allowing one's ideals to overwhelm the sense of moral duty inherent in public service.

""I do believe that, clearly, idealism comes first. You don't belong trying to run other people's lives unless you're committed to ideals,"" Frank said. ""But the more idealistic you are, the more morally you are obligated to be pragmatic.""

Read More",fakenewsnet,0,1,0.5576813
"Early voting has begun in the battleground state of North Carolina, and after months of contentious litigation, it’s clear why Republicans wanted to squash it: returns are showing Democrats with an eight point advantage over Republicans.

Data analysis from TargetSmart (who partnered with NBC News) shows that of the 4,000 plus presidential ballots that have been cast, 42 percent come from registered Democrats, 34 percent from Republicans, 25 percent from unaffiliated, and 1 percent from Libertarians.

Contrast that to 2012, when Mitt Romney won North Carolina by two percent: in early voting that year in that state, Republicans held a five percent lead. Now Democrats hold an eight percent lead. In 2008, when President Obama won (by a slim margin of 0.33 percent), Democrats had an 11 point advantage. In 2004, Democrats had an 11 point advantage, but Kerry lost to Bush by 13 percent.

So while it’s not set in stone that whoever accumulates the most early votes wins, the last two elections (in which early voting has increased tremendously) shows that is the case.

Nate Silver’s FiveThirtyEight currently gives Clinton a 43 percent chance of winning North Carolina (and a 62 percent chance of winning the election overall). Clinton’s chances have gone up almost five percent in the last week, with one reason being a strong showing for Democrats in early voting. The New York Times’ election model gives Clinton a 48 percent chance of winning North Carolina.

Again, no wonder Governor Pat McCory, who is currently losing his re-election bid, and the GOP legislature wanted to do away with it. When Democrats get a head start, that usually means good news in November.

Democrats shouldn’t get too comfortable. Although early voting points to a Democratic-leaning result, Republicans could very well (and chances are great) benefit from in person voting on November 8. President Obama never overcame Romney in the polls in the weeks leading up to the election, almost all the polls for the month of September favored Obama.

With 45 days left until the election, anything can happen, so Democrats need to continue to mobilize, register, and get out the vote for not just early ballots, but for November 8.

Rachel Maddow broke down the facts on her show:

Featured image via Justin Sullivan/Getty Images",fakenewsnet,1,0,0.39634755
"Donald Trump is calling for one of the most controversial and racially charged policies enacted by police departments to be expanded across the entire country. The city of New York recently ended “stop and frisk,” but Trump is pushing for it, apparently egged on by his top campaign surrogate, former New York City mayor Rudy Giuliani. From Politico:

In a pre-taped interview on Fox News scheduled to air Wednesday night, Trump was asked by an audience member what he would do to address “violence in the black community” and “black-on-black crime.” Trump responded by proposing that “stop-and-frisk” policing, in which an officer is empowered to stop an individual and frisk them for weapons or any other illegal contraband, be adopted nationwide. “I would do stop-and-frisk. I think you have to. We did it in New York, it worked incredibly well and you have to be proactive and, you know, you really help people sort of change their mind automatically,” Trump told the questioner.

Stop-and-frisk was repeatedly called out and protested against by New York City residents because the policy was shown time and time again to disproportionately target black and Latino residents. They were singled out for examination and interrogation by police officers, in what some felt were quotas set up by police management.

When the city stopped using stop-and-frisk, they did not see an increase in crime, despite claims from its supporters that there would be a spike in criminal activity. Most people who had been subject to stop-and-frisk were let go, because they hadn’t done anything wrong.

Former US District Court Judge Shira Scheindlin, who had ruled the procedure unconstitutional in federal court, described it as “destructive” in an interview with Buzzfeed. She added:

“In short, the overstopping in many communities harmed the relationship between the people and the police. Cooperation has now improved due to positive efforts by police to work with the community not against it.”

Featured image via Flickr",fakenewsnet,0,1,0.57723755
"A Ukraine policewoman is dead after contracting tuberculosis from a suspect that spat in her face.

Arina Koltsova, 35, was arresting a man on New Year’s Day when the suspect spat in her face, the Daily Mail reported. She didn’t know the man had tuberculosis at the time.

Koltsova went untreated for some time until she collapsed at work one day. She was then diagnosed with tuberculosis and started treatment.

Popular Video This young teenage singer was shocked when Keith Urban invited her on stage at his concert. A few moments later, he made her wildest dreams come true.

“She became ill after New Year's Day,” Her on-duty partner, Officer Mikhail Kindrakevich, told the Daily Mail. “She had arrested this guy and he spat in her face. Some time later she collapsed. She had received treatment. She underwent chemotherapy, she was fed food through an IV drip and she had lost a lot of weight”

Koltsova died on July 25. She was buried in Kiev two days later.

“This is an irreplaceable loss for the whole of Kiev police, fond memories of Arina will remain in our hearts forever,” Koltsova’s police department wrote on its social media page.

Popular Video This young teenage singer was shocked when Keith Urban invited her on stage at his concert. A few moments later, he made her wildest dreams come true:

“Arina wanted to change something for our country,” wrote one of her friends. “Joining the police was a conscious choice, she wanted to change things for better.”

According to the National Institutes of Health, tuberculosis can be treated by taking antibiotics six to 12 months. Some cases can be drug-resistant and are not easily treated. It is unclear if Koltsova had a drug-resistant form of tuberculosis or if she was not diagnosed quickly enough for effective treatment.

It is unclear if the suspect will be charged in Koltsova’s death.",fakenewsnet,0,1,0.51018643
"12k SHARES SHARE THIS STORY

Massive protests have broken out in Charlotte, North Carolina, after police shot and killed disabled African-American man named Keith Lamont Scott, who was apparently reading a book in his car, waiting for his son to come home from school when officers shot him dead. Details are still sketchy at the moment, but it appears the police were in search of of another armed man in the area.

Scott is the sixth civilian shot by Charlotte police this year.

Twelve officers have apparently been injured as tear gas canisters were fired into the crowd.

Coming so soon after the shooting of Terrence Crutcher in Tulsa, Oklahoma, it is clear that all the protests and anger at the disregard for the lives of black Americans shown by our police forces have accomplished nothing. Scott is the 215th black man shot by police this year.

This is an ongoing story that will be updated as new developments occur.",fakenewsnet,0,1,0.6301585
"Advertisement - story continues below

The first presidential debate between Democrat nominee Hillary Clinton and Republican rival Donald Trump was fully of fiery exchanges between the two candidates, as well as several questionable moments.

NBC’s Lester Holt, the moderator for the debate, started getting flak before the debate was over after he repeatedly interrupted Trump to “fact-check” him, except that his fact-checks were more or less wrong.

In one of the more contentious exchanges, Holt insisted that Trump had supported the Iraq War from the beginning, but Trump continuously denied it, USA Politics Today* reported.

Advertisement - story continues below

Rather than ask Clinton why she voted for the war, Holt continued to press Trump, saying that in an interview with Fox News’ Neil Cavuto, Trump expressed his support for the war.

After the debate was over, Cavuto aired the interview in question and showed that Trump wasn’t all gung-ho about invading Iraq before we went in — he had his reservations.

“You know, what happened to the days of Douglas MacArthur? I mean he would go in and attack. He wouldn’t talk. I mean we have to, you know, it’s sort of like either do it or don’t do it,” Trump said.

Advertisement - story continues below

“Well, he’s (Bush) either got to do something or not do something perhaps. Because perhaps he shouldn’t be doing it yet. Perhaps we should be waiting for the United Nations. You know, he’s under a lot of pressure,” said Trump, clearly unsure if invading Iraq was the right choice.

You can see it here:

Instead of hammering Trump for his alleged “support” for the Iraq War, the moderator really should have asked Clinton why she voted to authorize the war when she had access to much more information than Trump did.

Advertisement - story continues below

It shouldn’t surprise anyone that the mainstream media turned what could have been a substantive debate into a chance to try to smear Trump’s name.

Luckily, Trump held his own and showed that he could stand up to both Clinton and her media pals at the same time.

Share this on Facebook and Twitter and let us know what you thought of the debate on Monday night.

*USA Politics Today has since pulled their story.",fakenewsnet,1,0,0.45769465
"Story highlights Virginia Gov. Terry McAuliffe was photographed with Willie Nelson, and Nelson's marijuana

Nelson was in Bristow Saturday for a Farm Aid 2016 concert

(CNN) Hanging out with Willie Nelson over the weekend has left a cloud around Virginia Gov. Terry McAuliffe, after a photo of McAuliffe and the legendary marijuana-loving musician tweeted by Nelson's wife, Annie Nelson, included a can of ""Willie's Reserve"" -- Nelson's brand of weed.

It's sold in Colorado and is legal in Washington, but not Virginia -- a reality Annie Nelson might have been alluding to when she captioned the picture: """"UH-OH Trouble!""

McAuliffe spokesman Brian Coy told the Richmond Times-Dispatch that the Democratic governor has never used drugs in his life -- and isn't cool enough to know what Willie's Reserve is.

""He was not and still is not aware of whatever was on the table or anywhere around him and wouldn't know marijuana or related paraphernalia if it walked up and shook his hand,"" Coy said. ""He's cool, but he's not that cool.""

The newspaper's political reporter, Graham Moomaw, tweeted a zoomed-in photo of the can of Willie's Reserve weed, next to a pair of glasses and a remote control.

Let's enhance https://t.co/cmmucUKRTT pic.twitter.com/7YlX5za85l — Graham Moomaw (@gmoomaw) September 19, 2016

Read More",fakenewsnet,0,1,0.54911983
