text,source,label,pred_label,prob_fake
"If you want to watch a conservative throw a temper tantrum just mention slavery and grab your popcorn.

Because when First Lady Michelle Obama talked about slavery and the great progress our country has made since the Civil War during an interview at the new Smithsonian Institution’s National Museum of African American History and Culture, conservatives took to Twitter to whine.

Mrs. Obama told Good Morning America host Robin Roberts about how she feels about visiting the museum, which opens this weekend. And one of the things that struck her the most is the fact that a lot of the history the museum presents happened during the lives of the three generations of her family who visited the museum that day. And she expressed astonishment at how fast progress has been made.

“When you think about the fact that my great-great grandfather was a slave and today I live in the White House, that progress is huge and it’s fast,” the First Lady said.

Here’s the video via Twitter.

FLOTUS: “My great-great grandfather was a slave and today I live in the White House. That progress is huge.” https://t.co/A4RwUHYR5z pic.twitter.com/vvhgrtxoYu — ABC News (@ABC) September 23, 2016

But, of course, conservatives lost their shit and displayed their hatred in the comments.

@ABC And the sooner that Mooch and Obummer get out of the White house and Trump gets in, the better! #TrumpPence16 #MakeAmericaGreatAgain — Chantie Huffines (@LadyChantie) September 23, 2016

@ABC But, you keep the narrative going that all white people, except Clintons, are racist. — Deporable & watsit2u (@thumbug) September 23, 2016

@ABC The country is more racist than ever since The Obamas entered the White House. They have a bitter resentment for White People — Mike Van Patten (@MikeVanPatten4) September 23, 2016

@ABC So why are the democrats trying to send race relations back to the sixties? — Deplorable Voter (@Antone18) September 23, 2016

@ABC Keep driving racial segregation down our throats, ABC. These types of post should sure give you more “peaceful” protest to cover. — Ashton Allen (@Asherzz09) September 23, 2016

@ABC MOVE OUT BIMBO — Donna Coffey (@Dcoffey56Donna) September 23, 2016

@ABC Lord Jesus said to do good as bondmen. — John Stefanyszyn (@JohnStefanyszyn) September 23, 2016

@ABC And we can thank the Republican Party for that. It certainly wasn’t the Democrats. — Bev Cross (@BevCross1) September 23, 2016

@ABC then they managed to set us back decades by generating a racial divide n bringing anarchy among the people… awesome job NOT #GOTRUMP — Jane callaway (@janeewc) September 23, 2016

And while it is true that the early Republican Party freed the slaves, it was at a time when Republicans were liberals and Democrats were conservatives. The two parties have flipped since then. Democrats have since become the defenders of Civil Rights who continue to fight for racial equality and social justice while Republicans pandered to white racists in the South and have become dominated by white supremacists who desperately want to roll back any and all progress African-Americans have made in this country.

If Republicans have to go back 150 years to find one good thing the party did for African-Americans that’s really embarrassing and says a lot about what the party has become.

Featured image via Wikimedia",fakenewsnet,0,1,0.5520225
"Washington Since we last updated the CNN battleground map, Donald Trump has clearly improved his poll numbers both in some national polls and in some critical battleground states. The Republican nominee has also upped his game (as have his allied outside group friends) with television ad spending.

And, yet, Hillary Clinton maintains her advantage on the Road to 270 when it comes to piecing together the electoral math needed to win the presidency.

With four days to go before the highly anticipated first presidential debate and just under 7 weeks before all the votes are cast, Hillary Clinton still sits above that key threshold in the latest CNN outlook. When you add up all the states either solidly or currently leaning Clinton's way, she has 272 electoral votes in her column in our new estimate.



Hear CNN Political Director David Chalian explain the new race ratings in his podast:

What's changed?

-- Iowa (6) moves from from ""battleground"" to ""lean Republican""

-- Utah (6) moves from ""lean Republican"" to ""solid Republican""

-- Maine's 2nd Congressional District (1) moves from ""solid Democrat"" to ""battleground""

-- Nebraska's 2nd Congressional District (1) moves from ""solid Republican"" to ""battleground""

Road to 270: Electoral College map

Note: The split congressional district ratings are symbolized with diagonal lines.

The state of play

Donald Trump has improved his standing in our electoral college outlook due to Iowa (a state Barack Obama won twice) and its six electoral votes moving from the true toss-up ""battleground"" category into the ""lean Republican"" category, giving Trump a total of 196 electoral votes either solidly or leaning in his favor.

That leaves 70 electoral votes up for grabs across four states (plus two congressional districts) -- Florida, Nevada, Ohio, and North Carolina.

Maine and Nebraska award individual electoral votes by congressional district in addition to the multiple electoral votes based on statewide results. Both Maine and Nebraska's second congressional district have moved into battleground status in this latest estimate. Maine's second congressional district has moved from ""solid Democrat"" to ""battleground"" and Nebraska's second congressional district has moved from ""solid Republican"" to ""battleground,"" providing an opportunity for a candidate to pick up a single electoral vote in what otherwise might be hostile territory.

Finally, Utah moves back from ""leaning Republican"" to being solidly being in Trump's column.

There is no doubt that Trump has improved his chances in the last several weeks and that he is extremely competitive in all of the remaining critical battleground states, but Clinton's firewall is not yet showing any significant cracks and that is what makes Trump's path to 270 electoral votes still quite challenging.

For all of the endless talk about Florida, Ohio and North Carolina, it is perhaps most important to keep your eye on Clinton's performance in the states that are leaning her way, but not solidly in her camp. Pennsylvania, Colorado, Michigan, and Virginia are the core of Clinton's current stronger and more viable path to 270. If Trump begins to find significant inroads to any of those blue-leaning states, that will set off some alarm bells at her Brooklyn HQ and suggest a more viable path for Trump.

It is not enough for Trump to simply win the remaining 70 electoral votes in the battleground states -- that only gets him to 266. He still needs to chip away at Clinton's Democratic leaning firewall.

That's why we see both Trump and Clinton and their surrogates returning again and again to Pennsylvania, for example. And that's why Clinton and pro-Clinton forces spent more than $16 million on television ads in the Keystone State compared to the $5.3 million we've seen from Trump and pro-Trump forces. In fact, Pennsylvania is the state with the third-highest number of ad dollars spent this cycle, behind only Florida and Ohio.

Clinton and Trump will surely continue the fully engaged battle for the votes of Floridians and Ohioans, but until and unless Trump can put one of those Democratic leaning states back on the board as a battleground or even make one lean his way, Clinton's electoral college advantage holds.

Solid Republican:

Alabama (9), Alaska (3), Arkansas (6), Idaho (4), Indiana (11), Kansas (6), Kentucky (8), Louisiana (8), Mississippi (6), Missouri (10), Montana (3), Nebraska (4), North Dakota (3), Oklahoma (7), South Carolina (9), South Dakota (3), Tennessee (11), Texas (38), Utah (6)West Virginia (5), Wyoming (3) (163 total)

Leans Republican:

Arizona (11), Georgia (16), Iowa (6), (33 total)

Battleground states:

Florida (29), Nevada (6), Ohio (18), Maine 2nd Congressional District (1) Nebraska 2nd Congressional District (1), North Carolina (15) (70 total)

Leans Democratic:

Colorado (9), Michigan (16), New Hampshire (4), Pennsylvania (20), Virginia (13), Wisconsin (10), (72 total)

Solid Democratic:

California (55), Connecticut (7), Delaware (3), DC (3), Hawaii (4), Illinois (20), Maine (3), Maryland (10), Massachusetts (11), New Jersey (14), New York (29), Oregon (7), Rhode Island (4), Vermont (3), Washington (12), Minnesota (10), New Mexico (5) (200 total)",fakenewsnet,1,0,0.3889882
Building a wall on the U.S.-Mexico border will take literally years.,liar,0,1,0.7128416
Wisconsin is on pace to double the number of layoffs this year.,liar,1,0,0.35653323
Suzanne Bonamici supports a plan that will cut choice for Medicare Advantage seniors.,liar,0,1,0.7362766
Donald Trump is against marriage equality. He wants to go back.,liar,0,1,0.66972655
We know that more than half of Hillary Clintons meetings while she was secretary of state were given to major contributors to the Clinton Foundation.,liar,1,0,0.4793546
We know there are more Democrats in Georgia than Republicans. We know that for a fact.,liar,1,0,0.45596796
"Says 57 percent of federal spending goes to the military and just 1 percent goes to food and agriculture, including food stamps.",liar,1,0,0.24283025
On residency requirements for public workers,liar,0,1,0.766922
Unfortunately we have documented instances where people defecated in the (Statehouse) building.,liar,1,0,0.45335394
Ronald Reagan faced an even worse recession than the current one.,liar,1,0,0.43631718
There have not been any public safety issues in cities that allow transgender people to use the bathroom of the gender they identify as.,liar,0,1,0.5109456
The number of illegal immigrants could be 3 million. It could be 30 million.,liar,1,0,0.34693667
"Tim Kaine hiked tuition as governor, but now claims to champion affordability.",liar,0,1,0.560555
"Contends that President Obama literally said (if) his cap-and-trade proposals were to pass, that utility rates, his words now, would, necessarily skyrocket.",liar,0,1,0.57839787
Its been since 1888 that a Senate of a different party than the president in the White House confirmed a Supreme Court nominee.,liar,1,0,0.3934928
On which team hes rooting for in the World Series.,liar,0,1,0.54781824
"Because of the federal health care law, 300,000 health plans canceled in Florida.",liar,1,0,0.47429416
"In Massachusetts, Scott Brown pushed for a law to force women considering abortion -- force them -- to look at color photographs of developing fetuses.",liar,0,1,0.60072666
"Greg Abbott activated the state guard to monitor Jade Helm 15 in case the troops try to impose martial law, disarm innocent Texans, and detain them in tunnels beneath closed Walmart stores.",liar,0,1,0.5662126
Says he won the second debate with Hillary Clinton in a landslide in every poll.,liar,1,0,0.3683345
"Says as a result of the national health care reform, the Congressional Budget Office says we save $250 million over the first 10 years. Over the next 10 years, we save $1.2 trillion in savings in terms of health care.",liar,1,0,0.36183771
Says Charlie Crist voted against raising the minimum wage.,liar,0,1,0.5432728
When undocumented children are picked up at the border and told to appear later in court ... 90 percent do not then show up.,liar,1,0,0.34831476
Says Gov. Chris Christie cut spending (by) $1 billion and provided $850 million in new education funding.,liar,0,1,0.5122492
Hes the only candidate whos balanced budgets and brought jobs to Providence.,liar,0,1,0.51269615
"Studies have shown that in the absence of federal reproductive health funds, we are going to see the level of abortion in Georgia increase by about 44 percent.",liar,0,1,0.5233478
Sixty percent of the Hispanics support the Arizona immigration law,liar,1,0,0.40859815
Says Bill and Hillary Clinton attended Donald Trumps last wedding.,liar,0,1,0.5069934
Says Marco Rubio said Social Security and Medicare haveweakened us as a people.,liar,0,1,0.6387615
"As secretary of the Department of Energy under former President Bill Clinton, ""I created reserves of home heating oil.""",liar,0,1,0.5005011
"Says Donald Trump has said he loves war, including with nukes.",liar,0,1,0.5142399
What the facts say is ...the best scenario for kids is a loving mom and dad.,liar,1,0,0.4668984
Says Mark Neumann = Nancy Pelosi,liar,1,0,0.2639895
"To hear Gov. Christie tell it, everything in New Jersey is going just fine. Well I see another New Jersey with 400,000 unemployed. One of the worst jobless rates in the country. Working and middle class families have seen costs soar, from property taxes to college tuition.",liar,0,1,0.5212676
Proposition 2 on Novembers Texas ballot does not cost state taxpayers any money.,liar,0,1,0.62122965
The Texas Department of Transportation... misplaced a billion dollars.,liar,0,1,0.5150429
A judges order means theres a Constitution exemption zone if you live within 100 miles of the United States border.,liar,1,0,0.46674496
"Under Mayor Tom Barrett, the number of Milwaukee police officers has not increased.",liar,0,1,0.5616503
Taxpayers subsidize 80 percent of each MARTA trip,liar,1,0,0.46744725
Says Milken Institute rated San Antonio as nations top-performing local economy.,liar,0,1,0.54012084
Says people in Africa literally walk two and three hundred miles in order to vote.,liar,1,0,0.44424546
"Citizens Property Insurance has over $500 billion worth of risk, with less than $10 billion worth of surplus.",liar,1,0,0.25169417
Putting three Republicans in my Cabinet...is unprecedented.,liar,0,1,0.5018545
"When Atlanta Police Chief George Turner was interim head of the department, overall crime fell 14 percent and violent crime dropped 22.7 percent.",liar,1,0,0.44155362
"I am very proud, as governor of Florida, that we signed the first divestment act, as it relates to Iran, divesting any investments in companies that would invest in Iran.",liar,0,1,0.50692403
"As a result of climate change, ice fishermen in Wisconsin are already noticing fewer days they can be out on our ice covered lakes.",liar,0,1,0.7286972
Muslim nations did not call out the people who celebrated the 9/11 attacks.,liar,0,1,0.5859415
"The Taliban has been there for years and years, I mean, hundreds of thousands of years.",liar,1,0,0.3410277
Iran President Hassan Rouhani has more Cabinet members with Ph.D.s from American universities than members of Barack Obamas Cabinet.,liar,0,1,0.58511716
"The words subhuman mongrel, which Ted Nugent called President Barack Obama, were used by the Nazis to justify the genocide of the Jewish community.",liar,0,1,0.55731666
Says President Obama and his National Labor Relations Board sued Boeing over its decision to open a plant in South Carolina.,liar,0,1,0.62466115
"Says U.S. Sen. Ron Johnson led the fight to let polluters release unlimited amounts of carbon pollution and took nearly $225,000 from polluters.",liar,0,1,0.6125069
Orrin Hatch co-sponsored a 1993 health care bill that had an individual mandate.,liar,0,1,0.5296974
"Its entirely possible that the Democratic nominee, [Hillary Clinton], earned more money giving a single speech on Wall Street than I made the six years that I was there back in the 1980s In fact, its quite likely.",liar,1,0,0.44010746
Says Mitt Romney flip-flopped on an assault weapons ban.,liar,0,1,0.5107402
"When Tim Kaine was governor, spending soared, blowing holes in the budget every year.",liar,1,0,0.42222533
President Obama has the lowest public approval ratings of any president in modern times.,liar,1,0,0.35294405
"Neville Chamberlain told the British people: Accept the Nazis. Yes, they will dominate the continent of Europe, but that is not our problem. Lets appease them. Why? Because it cant be done. We cannot possibly stand against them.",liar,1,0,0.40982005
On running a civil and polite campaign.,liar,0,1,0.7506035
Tom Suozzi raised taxes by hundreds of millions of dollars as Nassau County executive.,liar,0,1,0.5299998
Mitt Romney drove to Canada with the family dog Seamus strapped to the roof of the car.,liar,0,1,0.6579207
Many of the founding fathers were very actively involved in cockfighting.,liar,1,0,0.31130472
Virginia has made no progress on jobs since Bob McDonnell took office.,liar,1,0,0.42477825
"The sex-offender registry has been around for a long time, and the research thats out there says that it has no positive impact on the public safety.",liar,0,1,0.5637825
"When the union says I want to eliminate tenure, thats not true.",liar,0,1,0.5815189
There is no record of congresswoman Betty Sutton ... ever holding a single in-person town hall meeting open to the general public.,liar,1,0,0.44614306
Says he got twice as much money from the sale of County Grounds land than Milwaukee County Executive Scott Walker was willing to accept.,liar,1,0,0.48886195
"We spend in tax loopholes annually $1.1 trillion. Thats more than we spend on our defense budget in a year, on Medicare or Medicaid in a year.",liar,1,0,0.20278196
This would be the largest casino in the United States.,liar,1,0,0.41274506
Barack Obama ... 96 percent of his votes have been solely along party line.,liar,0,1,0.51679367
President Obama and Nancy Pelosi said Obamacare would save money because they factored in 10 years worth of tax revenue and only six and half years worth of expenses.,liar,0,1,0.5942567
Says American polling shows Russian President Vladimir Putin has an 80 percent approval rating.,liar,0,1,0.549921
"Bill Nelson leased land that he owned for six cows, taking advantage of an agricultural tax loophole to dodge $43,000 in taxes just last year.",liar,0,1,0.501274
"In rural Virginia, Sen. Warner ran 8-10 points ahead of a traditional Democrat -- ahead of Senator Kaine, ahead of Governor McAuliffe.",liar,1,0,0.42718697
Mitt Romney left Massachusetts $1 billion in debt.,liar,1,0,0.44357386
Says Barack Obama promised he would cut the deficit in half but didnt.,liar,0,1,0.5732567
Says Denmarks suicide rate has been about twice as high as the United States over the past five decades.,liar,1,0,0.3072802
"China has total control, just about, of North Korea.",liar,1,0,0.44040102
The fact is the Clinton Foundation has got about 80 percent in overhead and 20 percent of the money is actually getting into the places it should.,liar,1,0,0.46454751
The U.S. Constitution owes its notion of democracy to the Iroquois Tribes.,liar,1,0,0.403367
Barack Obama has provided guns to Mexican drug cartels.,liar,0,1,0.6297075
"Gov. Romney himself, with 28 other Republican governors, supported policies that would have eliminated the time limits in the welfare reform law and allowed people to stay on welfare forever.",liar,1,0,0.43350258
"Right now, an employer has more of a chance of getting hit by lightning than be prosecuted for hiring an undocumented worker. That has to change.",liar,1,0,0.44779795
Wisconsin dropped from second in the country to 41st among states where more than half the students took the ACT exam.,liar,1,0,0.17307451
"Says At age 76 when you most need it, you are not eligible for cancer treatment under Affordable Care Act.",liar,1,0,0.41518158
...Secret documents reveal that Iran could obtain a nuclear weapon far sooner than we were told. And Tammy Duckworth voted yes (on the Iran nuclear deal).,liar,1,0,0.492128
The president campaigned against this type of legislation.,liar,0,1,0.60238814
"Seven hundred thousand. Thats how many California jobs will be lost thanks to the politicians raising the minimum wage.Now Florida is adding one million jobs, not losing them.",liar,1,0,0.495627
"The percentage of black children born without a father in the home has risen from 7 percent in 1964 to 73 percent today, due to changes from President Lyndon Johnsons Great Society.",liar,1,0,0.3744019
I said no to these big bank bailouts.,liar,0,1,0.596511
ACORN could get up to $8.5 billion more tax dollars despite being under investigation for voter registration fraud in a dozen states.,liar,1,0,0.31621197
On his half pay pledge.,liar,0,1,0.6210917
"Over 10 years, (extending tax cuts for the wealthy) would add less to the deficit than Obama added with the stimulus in one year.",liar,1,0,0.36854818
"Says New START, passed while Clinton was secretary of state, is a treaty cutting Russias nuclear arms.",liar,0,1,0.66408503
"Says in 2003 Texas cut $10 billion out of the entire budget, yet we put $1.8 billion more into public education. We put $800 million more into health and human services.",liar,1,0,0.27394006
Under Hillary Clintons plan illegal immigrants convicted of committing crimes get to stay.,liar,0,1,0.7148678
"Over the last several months, there was a review board headed by two distinguished Americans, Mike Mullen and Tom Pickering, who investigated every element of the Benghazi incident.",liar,1,0,0.47263247
Says a Ted Cruz ad has got me bull-dozing down a house.I never bulldozed it down. Its false advertising.,liar,0,1,0.6338908
Says 95 percent of people caught crossing the U.S.-Mexico border said in a survey we are coming because weve been promised amnesty.,liar,0,1,0.53779924
Obama said he would unilaterally renegotiate the North American Free Trade Agreement.,liar,0,1,0.5962048
"In the 513 days between Trayvon dying, and todays verdict, 11,106 African-Americans have been murdered by other African-Americans.",liar,1,0,0.30802107
Says If you compare the Portland Metro area to the CDCs statewide cavity rates ... the Portland Metro area would actually rank as having the 15th lowest cavity rate in the U.S.,liar,1,0,0.31096172
"He was offered medical care for his injuries if he would give up military information in return. John McCain said, 'No.'",liar,1,0,0.49988723
On federal stimulus money for expanding rail service.,liar,0,1,0.7416094
John McCain says it's okay with him if the U.S. spends the next thousand years in Iraq.,liar,0,1,0.5549479
"The Clinton Foundation is a charity where President and Secretary Clinton and their daughter, they take no salary, they get no money from it, they take no personal benefit from it.",liar,0,1,0.6536287
Barack Obama and Hillary Clinton have changed their positions (on the Iraq war withdrawal) to follow Chris Dodd.,liar,0,1,0.53579336
"When he worked for ATT, he ""was responsible for large parts in a $5 billion organization.""",liar,1,0,0.36082885
Says Ron Johnson gave himself a $10 million sweetheart corporate payout,liar,0,1,0.52756876
"Of the roughly 15 percent of Americans who dont have health insurance, half of them made more than $50,000 a year.",liar,1,0,0.21080612
"The United States can immediately tap a domestic energy resource of more than 1.5 trillion barrels of oil, six times more than Saudi Arabia.",liar,1,0,0.23292542
It is already in the law that there is a requirement to screen (refugees) for religion.,liar,0,1,0.6145403
On whether the government should bail out insurance giant AIG.,liar,0,1,0.75417614
"The Keystone pipeline creates 35 permanent jobs after construction, according to a government report.",liar,0,1,0.5236101
We're going to have more troops (in Afghanistan) . . . than the Russians had.,liar,1,0,0.41878194
"All four on Mount Rushmore, they were all independents at one critical point in their career.",liar,1,0,0.36310583
I brought down crime more than anyone in this country -- maybe in the history of this country -- while I was mayor of New York City. -,liar,1,0,0.28058487
"A planning group said that to meet anticipated traffic demands by 2035, Interstate 35 between Austin and Round Rock will need a dozen additional lanes going north and 14 additional southbound lanes.",liar,0,1,0.6137714
Rhode Islands unemployment insurance system is the most expensive such system in the country.,liar,1,0,0.46424642
"Says a YouTube video shows Thomas DiMassimo, the man who rushed Trump at an Ohio rally, dragging the American flag on the ground like it was a piece of garbage.",liar,0,1,0.59447926
"Obama worked with ""Sen. Dick Lugar, a Republican, to help lock down loose nuclear weapons.""",liar,0,1,0.5664907
The United States is at historic record highs of individuals being apprehended on the border from countries with terrorist ties such as Pakistan or Afghanistan or Syria.,liar,1,0,0.3915172
The transportation package passed by the General Assembly would impose the largest tax increase in Virginias history.,liar,0,1,0.55631703
"Onion Creeks highest flow rate on a recent night of flooding was 120,000 cubic feet per second, which is nearly double the average flow rate of Niagara Falls.",liar,1,0,0.3274149
Says his state budget will provide an increase in state funding for the 2011-12 school year.,liar,0,1,0.55433583
Sayvideo shows massive alligator strolling across Florida golf course.,liar,0,1,0.69015414
On whether people can keep their insurance under the Affordable Care Act.,liar,0,1,0.6905821
Weve introduced a bill that includes $12 billion in cuts over the next week.,liar,0,1,0.5108336
"Says Joseph Stalin said if you want to bring America down you, have to undermine three things: our spiritual life, our patriotism and our morality.",liar,1,0,0.34737194
"In 2011, Alabama and Massachusetts passed legislation allowing non-citizens who are legal residents to vote in state and local elections.",liar,1,0,0.39964566
"Across the country, more than half of the U.S. attorney seats remain without a prosecutor chosen by Obama.",liar,1,0,0.3109857
The Red Sox waited 87 long years to win the World Series.,liar,1,0,0.26772833
A recall election for Wisconsin governor would cost $7.7 million -- $7.7 million that may already be allocated to merit raises for teachers or health care for the poor or school books for your kids.,liar,0,1,0.5219288
